Requirements,Digital Infrastructure Management,Actors and Assets Management,Organization,Rights,Authenticity,Integrity,Non-repudiability,Confidentiality,Availability,Authorization,Unlinkability,Anonymity and Pseudonymity,Plausible Deniability,Undetectability and Unobservability,Awareness and Intervenability,Compliance,Trust Establishment,Trust Management,User Interaction,Accessibility
Complying with human rights and non-discrimination law,F,F,F,T,F,F,F,F,F,F,F,F,F,F,F,F,F,F,F,F
"Clearly defined regulation for enrollment, inclusion in identity infrastructure",F,F,F,T,F,F,F,F,F,F,F,F,F,F,F,F,F,F,F,F
"Meeting data protection and privacy imperatives, compliance with privacy laws and data protection regulations, accountability and legal compliance",F,F,F,T,F,F,F,F,F,F,F,F,F,F,F,T,F,F,F,F
Legal protection for users and protection of users rights,F,F,F,T,F,F,F,F,F,F,F,F,F,F,F,F,F,F,F,F
Digital identity cannot be inappropriately taken away,F,F,F,T,F,F,F,F,F,F,F,F,F,F,F,F,F,F,F,T
Implementation of Liability and law enforcement assurance mechanisms,F,F,F,T,F,F,F,F,F,F,F,F,F,F,F,F,F,F,F,F
Clear liability arrangements among all parties in the identity infrastructure,F,F,F,T,F,F,F,F,F,F,F,F,F,F,F,F,F,F,F,F
Ability to have recourse in case of violation of user rights,F,F,F,T,F,F,F,F,F,F,F,F,F,F,F,F,F,F,F,F
"Data Accuracy and trustworthiness",F,F,F,F,F,T,F,F,F,F,F,F,F,F,F,F,F,F,F,F
"Identity information validity, testability",F,F,F,F,T,T,F,F,F,F,F,F,F,F,F,F,F,F,F,F
"Unlinkability, minimal correlation possibility of cross-identity data",F,F,F,F,F,F,F,F,F,F,T,F,F,F,F,F,F,F,F,F
Data Minimization,F,F,F,F,F,F,F,T,F,F,T,F,F,F,F,F,F,F,F,F
"Openness of data for the data subject, ability to access and control the shared data",F,F,F,F,F,F,F,F,F,T,F,F,F,F,T,F,F,F,F,F
Let the user access and modify their own data,F,F,F,F,F,F,F,F,F,F,F,F,F,F,T,F,F,F,F,F
"Consent, controllable and controlled data disclosure and processing",F,F,F,F,F,F,F,F,F,T,F,F,F,F,T,F,F,F,F,F
"Transparency of processes, transactions, and purposes",F,F,F,F,F,F,F,F,F,F,F,F,F,F,T,F,F,F,F,F
Ensure user awareness,F,F,F,F,F,F,F,F,F,F,F,F,F,F,T,F,F,F,F,F
Long-term transparency (ensure transaprency even after changes in the system and its policies),F,F,F,F,F,F,F,F,F,F,F,F,F,F,T,F,F,F,F,F
Clear statement of use of credentials and data attributes,F,F,F,F,F,F,F,F,F,F,F,F,F,F,T,F,F,F,F,F
Establish clear policies and procedures for data handling,T,F,T,F,F,F,F,F,T,F,F,F,F,F,F,T,F,F,F,F
Purpose limitation,F,F,F,F,F,F,F,F,F,F,T,F,F,F,T,F,F,F,F,F
Storage limitation,F,F,F,F,F,F,F,F,F,F,F,F,F,F,T,F,F,F,F,F
"Plan for breaches, violation, and emergency situations in general",T,F,T,F,F,T,F,T,T,F,F,F,F,F,F,T,F,F,F,F
Anonymity and pseudonymity,F,F,F,F,F,F,F,F,F,F,F,T,F,F,F,F,F,F,F,F
Use of Open Source technologies and open standards,T,F,T,F,F,F,F,F,F,F,F,F,F,F,F,F,F,T,F,F
Segregation of Power,F,T,T,F,F,F,F,F,T,F,F,F,F,F,F,F,F,T,F,T
"Pluralism of Operators and technologies, ensure variety of providers",F,T,T,F,F,F,F,F,T,F,F,F,F,F,F,F,F,T,F,T
Vendor neutrality,F,T,T,F,F,F,F,F,T,F,F,F,F,F,F,F,F,T,F,T
IdM parties must demonstrate that security and privacy mechanisms are in place (assurance),F,F,F,F,F,F,F,F,F,F,F,F,F,F,F,F,F,T,F,F
Ease of access (and remove the barriers to it),F,F,F,F,F,F,F,F,F,F,F,F,F,F,F,F,F,F,F,T
Ease of enrollment (and remove the barriers to it),F,F,F,F,F,F,F,F,F,F,F,F,F,F,F,F,F,F,F,T
Enrollment in the Identity system is voluntary,F,F,F,T,F,F,F,F,F,F,F,F,F,F,F,F,F,F,F,T
Biometrics support,T,F,T,F,T,F,T,T,F,F,F,F,F,F,F,F,T,F,F,F
"Set RP practices, controls, rules",F,F,F,F,F,F,F,T,F,T,T,T,T,T,T,T,F,F,F,F
Consistency of user experience across different environments and contexts,F,F,F,F,F,F,F,F,F,F,F,F,F,F,F,F,F,F,T,F
Data synchronisation and consistency,T,F,T,F,F,F,F,F,T,F,F,F,F,F,F,F,F,F,T,F
Selective Disclosure of user data attributes,F,F,F,F,F,F,F,T,F,T,T,F,F,F,T,F,F,F,F,F
"Provide account, identity recovery options",F,F,F,F,F,F,F,F,F,F,F,F,F,F,F,F,F,F,F,T
"Ensure that only authentic, unforged, uncompromised identities are circulating",F,F,F,F,T,F,F,F,F,F,F,F,F,F,F,F,F,T,F,F
Secure IdP discovery mechanisms,F,F,F,F,F,F,F,F,F,F,F,F,F,F,F,F,T,F,F,F
"Implementation of strong, reliable authentication mechanisms",F,F,F,F,T,F,F,F,F,F,F,F,F,F,F,F,F,F,F,F
"Fairness, credibility, unbiasedness of IdM parties",F,T,T,F,F,F,F,F,F,F,F,F,F,F,F,F,F,T,F,F
Provide multiple authentication options,F,F,F,F,T,F,F,F,F,F,F,F,F,F,F,F,F,F,F,T
Prevent security compromise over the communciation channel,F,F,F,F,T,T,T,T,F,F,F,F,F,F,F,F,F,F,F,F
Transaction logging and auditing,T,F,T,F,F,F,F,F,F,F,F,F,F,F,F,F,F,T,F,F
Data is portable and can be processed by other systems,T,F,T,F,F,F,F,F,F,F,F,F,F,F,F,F,F,F,F,T
"The IdM is interoperable with other IdMs, external data, and RPs",T,F,T,F,F,F,F,F,F,F,F,F,F,F,F,F,F,F,F,T
"Establish system-wide baseline security and privacy practices (policy), potentially inline with international standards and frameworks",T,T,T,F,F,F,F,F,F,F,F,F,F,F,F,T,F,T,F,F
Intuitive and easy-to-use UI,F,F,F,F,F,F,F,F,F,F,F,F,F,F,F,F,F,F,T,F
Minimize access costs,F,T,T,F,F,F,F,F,F,F,F,F,F,F,F,F,F,F,T,T
Ensure that vetted external parties can enroll and access the infrastructure easily,T,T,T,F,F,F,F,F,F,F,F,F,F,F,F,F,F,F,F,T
Integration of digiital processes into the existing infrastructure,F,T,T,T,F,F,F,F,F,F,F,F,F,F,F,F,F,F,T,T
Legal validity of the digital id,F,T,T,T,F,F,F,F,F,F,F,F,F,F,F,F,F,F,T,T
"Secure mechanisms for establishing, maintaining and managing trust among parties",F,F,F,F,F,F,F,F,F,F,F,F,F,F,F,F,T,T,F,F
Exchange identity data only with trustworthy parties,F,F,F,F,F,F,F,F,F,F,F,F,F,F,F,F,T,T,F,F
Ensure multilateral security,F,F,F,F,T,F,T,F,F,F,F,F,F,F,F,F,F,F,F,F
Use of trust marks and verification process,F,T,T,F,F,F,F,F,F,F,F,F,F,F,F,F,F,T,F,F
Adoption of a trust framework,F,F,F,F,F,F,F,F,F,F,F,F,F,F,F,F,T,T,F,F
Adopt security and data standards for biometric data,T,F,T,F,T,T,F,T,F,F,F,F,F,F,F,F,F,F,F,F